Title,Summary,Case ID
"Brown v. U.S., No. 22-6389 [Arg: 11.27.2023]","Issue(s): Whether the ""serious drug offense"" definition in the Armed Career Criminal Act incorporates the federal drug schedules that were in effect at the time of the federal firearm offense or the federal drug schedules that were in effect at the time of the prior state drug offense.",22-6389
"McElrath v. Georgia, No. 22-721 [Arg: 11.28.2023]",Issue(s): Whether the double jeopardy clause of the Fifth Amendment prohibits a second prosecution for a crime of which a defendant was previously acquitted.,22-721
"Wilkinson v. Garland, No. 22-666 [Arg: 11.28.2023]","Issue(s): Whether an agency determination that a given set of established facts does not rise to the statutory standard of “exceptional and extremely unusual hardship” is a mixed question of law and fact reviewable under 8 U.S.C. § 1252(a)(2)(D), or whether this determination is a discretionary judgment call unreviewable under Section 1252(a)(2)(B)(i).",22-666
"Securities and Exchange Commission v. Jarkesy, No. 22-859 [Arg: 11.29.2023]",Issue(s): (1) Whether statutory provisions that empower the Securities and Exchange Commission to initiate and adjudicate administrative enforcement proceedings seeking civil penalties violate the Seventh Amendment; (2) whether statutory provisions that authorize the SEC to choose to enforce the securities laws through an agency adjudication instead of filing a district court action violate the nondelegation doctrine; and (3) whether Congress violated Article II by granting for-cause removal protection to administrative law judges in agencies whose heads enjoy for-cause removal protection.,22-859
"Harrington v. Purdue Pharma L.P., No. 23-124 [Arg: 12.4.2023]","Issue(s): Whether the Bankruptcy Code authorizes a court to approve, as part of a plan of reorganization under Chapter 11 of the Bankruptcy Code, a release that extinguishes claims held by nondebtors against nondebtor third parties, without the claimants’ consent.",23-124
"Moore v. U.S., No. 22-800 [Arg: 12.5.2023]",Issue(s): Whether the 16th Amendment authorizes Congress to tax unrealized sums without apportionment among the states.,22-800
"Muldrow v. City of St. Louis, Missouri, No. 22-193 [Arg: 12.6.2023]",Issue(s): Whether Title VII of the Civil Rights Act of 1964 prohibits discrimination in transfer decisions absent a separate court determination that the transfer decision caused a significant disadvantage.,22-193
